{
  "$schema": "https://json-schema.org/draft/2020-12/schema",
  "$id": "https://panoptes.dev/schemas/baseline-prompts.schema.json",
  "title": "Panoptes Baseline Prompt Set",
  "type": "object",
  "additionalProperties": false,
  "required": ["schema", "version", "created_utc", "settings", "prompts"],
  "properties": {
    "schema": {"const": "panoptes-baseline-prompts-v1"},
    "version": {"type": "string", "pattern": "^\\d+\\.\\d+\\.\\d+$"},
    "created_utc": {"type": "string", "pattern": "^\\d{4}-\\d{2}-\\d{2}T\\d{2}:\\d{2}:\\d{2}Z$"},
    "settings": {
      "type": "object",
      "additionalProperties": {"type": "string", "maxLength": 500}
    },
    "prompts": {
      "type": "array",
      "minItems": 1,
      "items": {
        "type": "object",
        "additionalProperties": false,
        "required": ["id", "kind", "title", "prompt", "target_words", "tags"],
        "properties": {
          "id": {"type": "string", "pattern": "^(text|code)-\\d{2}$"},
          "kind": {"enum": ["text", "code"]},
          "title": {"type": "string", "maxLength": 200},
          "prompt": {"type": "string", "minLength": 1, "maxLength": 20000},
          "target_words": {"type": "integer", "minimum": 1},
          "tags": {
            "type": "array",
            "maxItems": 12,
            "items": {"type": "string", "maxLength": 64, "pattern": "^[a-z0-9:_-]+$"}
          }
        }
      }
    },
    "artifact_sha256": {"type": "string", "pattern": "^[a-f0-9]{64}$"}
  }
}
