{
  "schema": "panoptes-baseline-prompts-v1",
  "version": "1.0.0",
  "created_utc": "2026-08-11T00:00:00Z",
  "settings": {
    "session": "Start a fresh session for every prompt: no chat history, memory, or prior context.",
    "system_prompt": "None. Use the product defaults; do not add custom instructions.",
    "sampling": "Provider default temperature and provider defaults for all other sampling settings.",
    "turns": "Single turn: send the prompt verbatim and record the complete first reply.",
    "tools": "Disable browsing, code execution, retrieval, and plugins where the interface allows.",
    "capture": "Save the raw, unedited reply as <prompt-id>.md and record the exact model version string shown by the product."
  },
  "prompts": [
    {
      "id": "text-01",
      "kind": "text",
      "title": "Neighbor plant note",
      "prompt": "Write a short note to my neighbor Dana asking her to water my two tomato plants while I am away for a long weekend. Keep it friendly, mention that the watering can is by the back door, and stay under 120 words.",
      "target_words": 100,
      "tags": ["genre:note", "length:50-149"]
    },
    {
      "id": "text-02",
      "kind": "text",
      "title": "Hash map explainer",
      "prompt": "Explain how a hash map works to a first-year computer science student. Cover buckets, hash collisions, and resizing. Use one small real-world analogy. Aim for about 300 words.",
      "target_words": 300,
      "tags": ["genre:explainer", "length:150-499"]
    },
    {
      "id": "text-03",
      "kind": "text",
      "title": "Public libraries essay",
      "prompt": "Write an essay of about 800 words discussing how public libraries have changed over the last fifty years and what role they might play in the next fifty. Include at least one concrete example of a service libraries offer today that they did not offer twenty years ago.",
      "target_words": 800,
      "tags": ["genre:essay", "length:500plus"]
    },
    {
      "id": "text-04",
      "kind": "text",
      "title": "Lighthouse mystery opening",
      "prompt": "Write the opening page of a mystery novel, about 250 words. The story begins with a lighthouse keeper on the Oregon coast noticing that the light from the neighboring lighthouse, unmanned for thirty years, has started blinking again in a regular pattern.",
      "target_words": 250,
      "tags": ["genre:creative", "length:150-499"]
    },
    {
      "id": "text-05",
      "kind": "text",
      "title": "Constrained delay email",
      "prompt": "Write a professional email to a project team announcing that the launch of a mobile banking app is delayed by three weeks. Requirements: exactly three bullet points listing the reasons, a revised launch date of October 14, and a closing sentence thanking the team. About 150 words.",
      "target_words": 150,
      "tags": ["genre:email", "length:150-499"]
    },
    {
      "id": "text-06",
      "kind": "text",
      "title": "Composting summary",
      "prompt": "Summarize the following passage in exactly three sentences. Do not add information that is not in the passage.\n\nPassage:\nComposting turns kitchen scraps and yard waste into a dark, crumbly soil amendment called humus. The process depends on a balance of \"greens,\" such as vegetable peels and fresh grass clippings, which supply nitrogen, and \"browns,\" such as dried leaves and cardboard, which supply carbon. A widely cited rule of thumb is to keep roughly three parts browns to one part greens by volume. Microorganisms do most of the work, and they need moisture and oxygen to thrive, so a pile should feel like a wrung-out sponge and be turned every week or two. Under good conditions a hot pile can finish in two to three months, while a neglected cold pile may take a year. Meat, dairy, and oily foods are usually excluded from open piles because they attract pests, though enclosed systems can handle them. Finished compost smells earthy rather than sour, and none of the original material should be recognizable.",
      "target_words": 60,
      "tags": ["genre:summary", "length:lt50"]
    },
    {
      "id": "text-07",
      "kind": "text",
      "title": "Personal finance op-ed",
      "prompt": "Write a persuasive opinion piece of about 400 words arguing that every high school student should complete a personal finance course before graduation. Address one common counterargument and respond to it.",
      "target_words": 400,
      "tags": ["genre:opinion", "length:150-499"]
    },
    {
      "id": "text-08",
      "kind": "text",
      "title": "Cast-iron how-to",
      "prompt": "Write a step-by-step guide to seasoning and caring for a cast-iron skillet. Format it as a numbered list of exactly seven steps. Give each step a short bolded title followed by one or two sentences.",
      "target_words": 300,
      "tags": ["genre:howto", "length:150-499"]
    },
    {
      "id": "code-01",
      "kind": "code",
      "title": "Log level counter",
      "prompt": "Write a Python function `parse_log_levels(text: str) -> dict[str, int]` that returns a count of how many lines in a log file begin with `INFO`, `WARN`, or `ERROR` (case-sensitive). Lines beginning with anything else are ignored. Include a one-line docstring.",
      "target_words": 40,
      "tags": ["lang:python", "task:utility"]
    },
    {
      "id": "code-02",
      "kind": "code",
      "title": "LRU cache",
      "prompt": "Implement an LRU cache in Python as a class `LRUCache` with `get(key)` and `put(key, value)`, both O(1) on average. The constructor takes a positive integer `capacity`; `get` returns -1 for missing keys. After the code, explain in two sentences why your design meets the complexity requirement.",
      "target_words": 80,
      "tags": ["lang:python", "task:data-structure"]
    },
    {
      "id": "code-03",
      "kind": "code",
      "title": "Countdown timer component",
      "prompt": "Write a React component in TypeScript named `CountdownTimer`. It accepts a prop `seconds` and displays the remaining time formatted as `mm:ss`, updating once per second until it reaches `00:00`. Include the props interface and clean up any timers.",
      "target_words": 60,
      "tags": ["lang:typescript", "task:ui-component"]
    },
    {
      "id": "code-04",
      "kind": "code",
      "title": "Largest files CLI",
      "prompt": "Write a Python command-line script that takes a directory path as its only argument and prints the five largest regular files directly inside that directory (not recursive), largest first, with sizes shown in megabytes to two decimals. Handle the case where the directory does not exist.",
      "target_words": 40,
      "tags": ["lang:python", "task:cli"]
    },
    {
      "id": "code-05",
      "kind": "code",
      "title": "Second-largest bug fix",
      "prompt": "The Python function below should return the second-largest distinct value in a list of numbers, or None if no such value exists. It contains a bug. In one or two sentences explain the bug, then provide the corrected function.\n\n```python\ndef second_largest(values):\n    values = sorted(values)\n    if len(values) < 2:\n        return None\n    return values[-2]\n```",
      "target_words": 50,
      "tags": ["lang:python", "task:bug-fix"]
    },
    {
      "id": "code-06",
      "kind": "code",
      "title": "Clamp test suite",
      "prompt": "Write a pytest test suite for the Python function below. Cover normal behavior, boundary values, and the error case. Use parametrization where it improves clarity.\n\n```python\ndef clamp(value: float, low: float, high: float) -> float:\n    \"\"\"Clamp value into the inclusive range [low, high].\"\"\"\n    if low > high:\n        raise ValueError(\"low must not exceed high\")\n    return max(low, min(high, value))\n```",
      "target_words": 80,
      "tags": ["lang:python", "task:test-writing"]
    },
    {
      "id": "code-07",
      "kind": "code",
      "title": "Customer order summary query",
      "prompt": "Given a table `orders(id INTEGER PRIMARY KEY, customer_id INTEGER NOT NULL, total_cents INTEGER NOT NULL, created_at TEXT NOT NULL)`, write a SQL query that returns one row per customer with columns `customer_id`, `order_count`, and `total_dollars` (total spend in dollars, two decimal places). Include only customers with more than three orders, and order by total spend descending.",
      "target_words": 30,
      "tags": ["lang:sql", "task:query"]
    },
    {
      "id": "code-08",
      "kind": "code",
      "title": "TTL cache class",
      "prompt": "Design and implement a Python class `TTLCache` using only the standard library. It must support `set(key, value, ttl_seconds)`, `get(key)`, and `delete(key)`. Expired entries must behave exactly as if they were never set. Include a short usage example in a comment at the bottom.",
      "target_words": 90,
      "tags": ["lang:python", "task:class-design"]
    }
  ],
  "artifact_sha256": "2092321df751db3dc9dec61f4a122967e381ef61b1ed0607893882476bc8b06b"
}
